keyword,question,answer,url,source
고혈압,고혈압 환자는 왜 ‘심뇌혈관질환’을 주의해야 하나요?,"고혈압이란 위 팔에 혈압대를 감아 측정한 동맥의 압력을 기준으로 수축기 혈압 140mmHg 이상, 또는 이완기 혈압 90mmHg 이상인 경우를 말합니다.고혈압은 심뇌혈관질환의 발생률을 가장 크게 높이는 위험요인입니다.고혈압을 치료하지 않고 상태가 지속되면 혈관벽에 지속해서 강한 압력이 가해집니다. 그 결과 동맥혈관에 죽상경화증이 생겨 혈관이 약해지고 상처가 나면서 동맥벽이 두꺼워지고 딱딱해져서 고혈압에 의한 장기 손상이 초래됩니다. 결국 허혈성심 질환(협심증, 심근경색증 등)이나 심부전, 뇌졸중과 같은 심뇌혈관질환이 발생합니다.",https://health.kdca.go.kr/healthinfo/biz/health/ntcnInfo/healthSourc/thtimtCntnts/thtimtCntntsView.do,국가건강정보포털
고혈압,고혈압의 원인은 유전인가요? 생활 습관 개선으로 예방할 수 있나요?,"고혈압은 유전적인 특성이 강한데, 부모가 모두 고혈압이면 자녀가 고혈압에 걸릴 확률은 약 80% 정도이며, 이때 나쁜 습관 등 환경적인 요인이 겹치면 고혈압이 더 잘 발생하게 됩니다.고혈압의 가족력이 있다 하더라도 생활습관을 개선하면 고혈압의 발생을 줄일 수 있는데, 체중감량, 짜지 않게 먹기, 절주, 금연, 그리고 규칙적인 운동이고혈압 예방에 좋은 방법입니다.",https://health.kdca.go.kr/healthinfo/biz/health/ntcnInfo/healthSourc/thtimtCntnts/thtimtCntntsView.do,국가건강정보포털
고혈압,고혈압 증상의 응급처치 방법은 어떤 것들이 있나요?,"고혈압은 표적 장기 손상(심장, 뇌, 눈 등 중요 장기의 고혈압에 의한 손상) 전까지는 특별한 증세가 없는 것이 보통이지만, 두통, 두근거림, 호흡곤란 등이 나타날 수 있습니다.만 일정확한 방법으로 혈압을 측정해도 평소보다 높으면서 두통, 구역질, 구토, 시야 흐려짐 등이 발생했다면 빨리 병원을 찾아야 합니다. 그런 증상이 없다면 30분~1시간 정도 심리적, 신체적으로 안정을 취한 뒤 다시 측정해 봅니다. 불면, 스트레스, 과도한 활동, 폭음 등의 원인에 의해일 시적으로 혈압이 높아질 수 있습니다.",https://health.kdca.go.kr/healthinfo/biz/health/ntcnInfo/healthSourc/thtimtCntnts/thtimtCntntsView.do,국가건강정보포털
고혈압,고혈압 치료를 하고 약을 먹어야 하나요?,"확실히 고혈압을 진단받은 환자라면 의사와 상의 없이 임의로 약물을 끊어서는 안 됩니다.특히 중년을 넘었고, 단기간 혈압을 올릴 만한 원인(비만, 진통제, 통증, 스트레스 등)이 없으며, 표적 장기 손상이 있다면 더욱 그렇습니다.고혈압은 증상이 없는 경우가 많아 환자들이 치료의 중요성을 간과하기 쉽습니다.고혈압을 치료하는 이유는 증상을 치료하기 위해서라기보다는 고혈압으로 인한 합병증을 최소화하기 위해서입니다.고혈압을 앓고 있는 사람은 고혈압의 합병 증인 뇌졸중 및 관상동맥질환의 위험이 정상인에 비해 2.5배 이상 높기 때문에 주기적인 검진과 적절한 치료가 꼭 필요합니다. 또한, 고혈압 치료로 약 복용 중 깜빡하고 잊어버렸다면 생각나는 즉시 혈압약을 복용합니다.다만, 너무 늦은 시간 알아차렸다면 (저녁시간이 가까워지면), 다음날 복용합니다. 빼먹었다고 배로 먹거나, 주변 사람 혈압약을 빌려 먹지 않습니다.",https://health.kdca.go.kr/healthinfo/biz/health/ntcnInfo/healthSourc/thtimtCntnts/thtimtCntntsView.do,국가건강정보포털
고혈압,집에서도 혈압을 측정해 보고 싶은데 어떻게 측정해야 하나요?,"집에서 혈압을 측정할 때는 아침에 일어난 후 1시간 이내, 소변을 본 후, 아침식사 전, 고혈압약 복용 전, 밤에는 취침 전에, 검증된 혈압계로 측정합니다.측정시, 2분 정도의 시간 간격을 두고 2회 이상 측정하여 평균을 냅니다. 처음 측정할 때에는 양팔의 혈압을 모두 측정합니다.정상적으로 10mmHg 이내 범위의 양팔의 혈압 차이는 있을 수 있습니다. 처음에는 양팔에서 혈압을 측정한 뒤, 다음부터는 혈압 수치가 더 높은 팔을 측정합니다. 그리고 처음 진단할 때는 적 어도 1주일 동안, 치료 결과 평가 시에는 가능한 여러 날 측정하며 적어도 외래 방문 직전 5~7일간 측정을 권장합니다.",https://health.kdca.go.kr/healthinfo/biz/health/ntcnInfo/healthSourc/thtimtCntnts/thtimtCntntsView.do,국가건강정보포털
고혈압,무조건 짜게 먹지 말라고 하는데 하루 어느 정도 나트륨을 섭취하는 게 좋은가요?,"염분에 따른 혈압 상승 정도는 사람마다 다르나, 일반적으로 짜게 먹을수록 혈압이 높아지고 소금 섭취를 줄이면 혈압이 낮아지는 편입니다.세계 식량농업기구와 세계보건기구에서는 하루나트륨 섭취량을 2,000mg 이하로 권장하고 있습니다.이는 소금으로 치면 5g이고, 1티스푼 정도입니다. 우리나라 일반적인 성인이 하루에 섭취하는 소금양은 7~8g 정도이므로 절반 정도로 줄인다는 생각으로 싱겁게 드시는 것이 좋습니다. 특히 국물이나 찌개는 나트륨 농도 가 낮더라도 전체 국물 양이 많이 때문에 국에 말아 먹거나 찌개를 비벼 먹지 않는 것이 중요합니다.",https://health.kdca.go.kr/healthinfo/biz/health/ntcnInfo/healthSourc/thtimtCntnts/thtimtCntntsView.do,국가건강정보포털
고혈압,고혈압의 기준은 무엇이며 .정상적인 혈압은 어떤 상태를 말합니까?,"세계보건기구(W.H.O)에서 정한 기준에 의하면 혈압상태를 다음의 4단계로 규정하고 있습니다. 세계보건기구에서 정한 기준(단위㎜ Hg) 저혈압: 최고 혈압 100 이하, 최저혈압 60이하 정상 혈압: 최고혈압 140 이하, 최저혈압 90이하 경계역(고) 혈압: 최고 혈압 140~160, 최저혈압 90~95 고혈압: 최고혈압 160이상, 최저혈압 95이상 그러나 W.H.O에서 기준이 정해진 이후 장기간 관찰한 결과 확장기혈 압이 90㎜ Hg 이상에서는 여러 가지 합병증이 발생한다는 것이 밝혀져서 미국 합동 전문위원회(J.N.C)에서는 확장기 혈압 90㎜ Hg 이상을 고혈압으로 하고 치료의 대상으로 정했습니다.",http://www.acdm.or.kr/bbs/505.php?&fm_id=2&page=1,한국만성질환관리협회
고혈압,고혈압은 왜 문제가 되고 있습니까?,"① 유병률이 높고, ②사망률이 높으며, ③확실한 치료방법이 없으며, ④무서운 합병증을 수반하며 ⑤결국 주요 사인이 되기 때문입니다.",http://www.acdm.or.kr/bbs/505.php?&fm_id=2&page=1,한국만성질환관리협회
고혈압,고혈압 발생의 위험 유인들은 무엇입니까?,"① 유전적 소질②식염의 과잉 섭취 ③ 스트레스, 흥분④과 체중, 비만 및 운동 부족 ⑤ 흡연과 과도한 음주 ⑥ 연령의 증가⑦한 냉에의 노출 등입니다.",http://www.acdm.or.kr/bbs/505.php?&fm_id=2&page=2,한국만성질환관리협회
고혈압,식염을 과잉 섭취했을 때 나타나는 위험 상태는 무엇입니까?,소금은 체내의 수분량을 증가시키고 혈관을 수축시키는 작용이 있어 혈압을 상승시켜줍니다.참고로 우리나라 사람들은 하루에 15~20g의 소금을 먹고 있는데 이는 간장·된장·고추장 등 여러 염장 식품들을 먹기 때문입니다. 선진국처럼 10g 이하로 줄이도록 노력해야 하겠습니다.,http://www.acdm.or.kr/bbs/505.php?&fm_id=2&page=3,한국만성질환관리협회
고혈압,스트레스를 받으면 혈압이 올라간다는데 그 이유는 무엇입니까?,"스트레스를 받으면 긴장하거나 흥분할 떄 맹렬한 반응을 일으키는 교감신경이 활성화되는데, 교감신경이 자극되면 혈관을 수축시키는 호르몬이 분비되어 혈압이 오르면서 심장도 빨리 뜁니다.",http://www.acdm.or.kr/bbs/505.php?&fm_id=2&page=4,한국만성질환관리협회
고혈압,흡연과 과음은 왜 혈압을 상승시킵니까?,"담배의 니코틴은 혈관을 수축시키므로 혈압을 상승시킵니다. 또 니코틴은 동맥경화를 촉진하고 헤모글로빈의 산화를 방해하며 산소 공급을 저하시키므로 심장혈관의 노화를 촉진시키기기도 합니다.술도 또한 체내에서 분해되는 과정에서 혈압을 높이는 물질로 변하므로 술기운이 떨어졌을 때의 불안, 초조는 초조는 스트레스로 작용됩니다.",http://www.acdm.or.kr/bbs/505.php?&fm_id=2&page=5,한국만성질환관리협회
고혈압,연령이 높을수록 혈압이 높아진다는 데 사실입니까?,"중년기 이후, 비교적 급상승을 보이는데 남자는 여자보다 5~10㎜ Hg만큼 더 높아지며, 60대 이후는 수축기(최고) 혈압이 급격히 상승하는 반면, 확장기(최저) 혈압은 다소 떨어지는 경향이 있습니다. 여자는 50세 갱년기를 전후해서 혈압이 높아지는 경향이 있습니다.",http://www.acdm.or.kr/bbs/505.php?&fm_id=2&page=6,한국만성질환관리협회
고혈압,고혈압의 초기 증상은 무엇입니까?,"①두 중 감·두통·현기증·정신 집중장애 ② 가슴이 뛰고 가벼운 운동에도 숨이 차게 되고 ③시력 감퇴·이병·신경과민, 흥분하기 쉬운 경향이 있습니다.",http://www.acdm.or.kr/bbs/505.php?&fm_id=2&page=7,한국만성질환관리협회
고혈압,고혈압의 합병증은 어떤 것들이 있습니까?,"뇌·심장·신장 그리고 눈에 심한 합병증을 초래하는데, 대동맥 말초혈관에도 병변이 발생하여 뇌졸중·심부전·허혈성 심장질환·신부전·시력장애·박리성 대동맥류·간혈성 파행증(間歇性跛行症) 등이 발생합니다.이들은 모두 치사율이 매우 높아 큰 문제입니다.",http://www.acdm.or.kr/bbs/505.php?&fm_id=2&page=8,한국만성질환관리협회
고혈압,심부전의 증상은 무엇입니까?,심장은 높은 혈압을 받으면 심장이 커지며 펌프 작용이 약화되고 심박 출량도 감소되어 혈액 공급을 못하게 됩니다. 이렇게 되면 하지(다리)에 부종이 오고 호흡이 곤란해져 기좌호흡의 증상 등이 나타납니다.,http://www.acdm.or.kr/bbs/505.php?&fm_id=2&page=9,한국만성질환관리협회
고혈압,뇌졸중이란 무엇입니까?,"뇌졸중은 뇌출혈과 뇌경색으로 구분하는데.과거에 뇌일혈이라 불리웠던 뇌출혈은, 뇌동맥의 가느다란 가지에 생긴 혈관 변성으로 생긴 동맥류가 터져 출혈하는 것이고, 그동안 우리나라에서 사망 원인 1위였으며 40~50대에 많았던 뇌졸중의 대표적인 병형입니다. 그리고 과거에 뇌연화라고 불렀던 뇌경색은 동맥경화로 뇌동맥이 막혀 뇌조직이 괴사하는 상태를 말하는데, 요사이는 이 병이 더 많아지는 추세입니다.",http://www.acdm.or.kr/bbs/505.php?&fm_id=2&page=10,한국만성질환관리협회
고혈압,신부전의 증상은 무엇입니까?,전 신 부종으로 요독증이 되며 혈압을 더욱 상승시키는 악순환을 일으키고 신동맥의 병변이 고혈압의 변성을 더욱 심화시켜 악성 고혈압으로 발전되면 위험하게 됩니다.,http://www.acdm.or.kr/bbs/505.php?&fm_id=2&page=11,한국만성질환관리협회
고혈압,허혈성 심장질환의 증상은 무엇입니까?,"심한 흉통이 특징이며, 24시간 내에 급사하는 경우가 많습니다. 그 이유는 동맥경화로 관상동맥 내강이 더욱 좁아지거나 완전히 막히기 때문입니다. 일반적으로 심근의 산소 부족 때문에 심한 통증을 일으켜 처음엔 협심증이 나타나게 되지만, 더욱 진행되어 산소 공급이 심히 부족하게 되면 심근이 괴사하여 심근경색증이 되기도 합니다.",http://www.acdm.or.kr/bbs/505.php?&fm_id=2&page=12,한국만성질환관리협회
고혈압,고혈압에서의 시력장애는 어떻게 나타납니까?,"고혈압은 안저에 고혈압성 병변을 일으켜 출혈, 삼출몰 등이 발생하여 안저의 신경세포를 뒤덮으며 부분적으로 시력장애가 나타납니다.",http://www.acdm.or.kr/bbs/505.php?&fm_id=2&page=13,한국만성질환관리협회
고혈압,"대동맥류, 간헐성 파행증이란 무엇입니까?","대동맥, 말초동맥 특히 다리의 동맥에 동맥경화를 일으키고 대동맥의 외벽이 갈라져 박리성 대동맥류가 될 수 있으며, 파열되면 급사하게 됩니다. 또 다리의 동맥경화로 통증을 느껴 보행을 하기가 어렵습니다.이를 간헐성 파행증이라고 합니다.",http://www.acdm.or.kr/bbs/505.php?&fm_id=2&page=14,한국만성질환관리협회
고혈압,고혈압의 생활요법은 무엇입니까?,"①식염 섭취를 하루 10g 이하로 줄이도록 노력하고, ②스트레스의 해소에 노력하며, ③ 체중 조절을 위해 주 3회 이상, 1회 30분 이상 운동을 하고, ④무절제한과 식을 피하며, ⑤금연, ⑥과 음을 피하고, ⑦ 명상생활을 할 것 등입니다.",http://www.acdm.or.kr/bbs/505.php?&fm_id=2&page=2,한국만성질환관리협회
고혈압,혈압은 왜 오릅니까?,"생명의 최소 단위인 세포들에게 신진대사를 윙 해산소를 공급해야 되는데 혈액순환 상태가 나빠져 산소 공급이 잘 안 되니 신체의 최고사령관이며 콘트롤센터인 뇌하수체에서 부신에 명령을 내려 배수장의 가압장치를 풀가 동시켜 수압을 높이는 조치를 취하도록 합니다.부신의 수질에서는 에피테프린과 노르에피네 프린이란 혈압 상승 호르몬을 분비하여 심박 출량과 말초혈관 저항을 증대시킴으로써 혈압을 상승시킵니다. 이렇게 해서 말초의 조직세포들은 겨우 숨을 돌리게 되는데 , 이때 신체의 주인은 혈압이 높아졌다고 우왕좌왕하면서 혈압 강하제를 먹고 혈압이 떨어지면 또 조직세포에서는 숨이 차다고 아우성하게 됩니다.",http://www.acdm.or.kr/bbs/505.php?&fm_id=2&page=2,한국만성질환관리협회
고혈압,건강보조식품 E.P.A와 동맥경화 예방과의 관계는 무엇입니까?,"EPA는 혈중의 콜레스테롤과 중성지방을 낮추어 고지질혈증을 예방하면, 혈소판의 응집을 억제하여 혈전을 예방하고, 또 나쁜 콜레스테롤인 LDL(저밀도지단백)를 저하시키고 좋은 콜레스테롤인 HDL(고밀도지단백)의 양을 증가시켜 동맥경화증을 예방해준다고 알려져 있습니다.",http://www.acdm.or.kr/bbs/505.php?&fm_id=2&page=2,한국만성질환관리협회
고혈압,혈압과 맥박의 차이는 어느 정도입니까?,"혈압은 한마디로 말해서 혈관 속을 흐르고 있는 혈액이 혈관벽에 미치는 압력을 말하며, 맥박은 혈액이 혈관에 부딪치는 일로 인해 나타나는 현상을 말합니다.",http://www.acdm.or.kr/bbs/505.php?&fm_id=2&page=2,한국만성질환관리협회
고혈압,보통 수축기 혈압보다 확장기 혈압이 더 중요하다고 하는데 그 이유는 무엇입니까?,확장기(최저) 혈압이 혈관의 강화 상태를 잘 나타내기 때문입니다.즉.혈관의 상태가 나쁘면 높은 혈압을 이겨낼 수가 없기 때문입니다.,http://www.acdm.or.kr/bbs/505.php?&fm_id=2&page=3,한국만성질환관리협회
고혈압,고혈압의 구분은 어떻게 합니까?,"고혈압에는 75~90%를 차지하는 데 본태성고혈압과 10~25%를 차지하는 속발성 고혈압이 있는데, 속발성 고혈압은 신장병, 갈색세포종, 쿠싱 증후군 등이 원인이 되어 이로 인해 혈압이 높아지는 2차성 고혈압입니다. 우리가 보통 말하는 고혈압은 본태성 고혈압을 말하며 40대 이후 고혈압의 대부분은 이에 속합니다.",http://www.acdm.or.kr/bbs/505.php?&fm_id=2&page=4,한국만성질환관리협회
고혈압,혈전이란 무엇을 말합니까?,혈소판이 응집하여 생긴 핏 덩어리를 말합니다.,http://www.acdm.or.kr/bbs/505.php?&fm_id=2&page=5,한국만성질환관리협회
고혈압,혈소판이란 무엇을 말합니까?,"혈액의 한 성분으로 혈관이 터진다든지, 상처를 입었을 때 그곳을 땜질하여 혈액이 바깥으로 새어나가는 것을 막기 위해 한데 모여 엉키게 하는 작용을 하는데, 혈소판에 아무런 이상이 없어도 함부로 엉키는 경우, 즉 비정상인 혈소판의 응집도 있습니다.",http://www.acdm.or.kr/bbs/505.php?&fm_id=2&page=6,한국만성질환관리협회
고혈압,혈전이 생기는 원인이 무엇입니까?,"보통 혈관 내 피의 손상이나 염증, 혈액 응고의 항진 등을 들을 수 있으나, 과산질과 같은 유리기에 의해 혈소판의 막에 장애가 생기는 데서 원인이 있다고 합니다.",http://www.acdm.or.kr/bbs/505.php?&fm_id=2&page=7,한국만성질환관리협회
고혈압,경색이란 무엇입니까?,혈전이 혈관의 구멍을 막아버려 혈액이 흐르지 못함으로써 그 이하 부분의 조직이 괴사되는 상태를 말합니다.,http://www.acdm.or.kr/bbs/505.php?&fm_id=2&page=8,한국만성질환관리협회
고혈압,EPA와 혈전증 방지와의 관계는 무엇입니까?,EPA에서 만들어진 프로스타글란딘은 강력한 혈소판 응집 억제 작용과 혈관 확장 작용이 있어 혈전을 방지하고 혈압을 낮춘다고 합니다.,http://www.acdm.or.kr/bbs/505.php?&fm_id=2&page=9,한국만성질환관리협회
고혈압,EPA와 심근경색 예방과의 관계는 무엇입니까?,"심근경색이란, 심장 근육에 절대로 필요한 산소와 영양물질을 공급하는 파이프라인인 관상동맥이 막혀서 혈액순환이 단절되는 상태인데, 이렇게 되면 심근의 조직세포가 괴사됩니다.이에는 콜레스테롤, 중성지방 등의 혈중 지질 증가로 인한 관상동맥의 죽상경화가 주요 원인이 됩니다.이 병을 악화시키는 것으로는, 혈소판의 응집에 의한 혈전과 교감신경의 흥분에 의한 관상동맥의 연축(연縮)이 있습니다. 그런데 동맥의 연축(연縮)이 있습니다. 그런데 EPA의 생 리적작용은, ①혈 중 콜레스테롤 및 중성지방의 수준을 낮추고 ②혈소판의 응집을 억제하여 혈전을 방지하며 ③교감신경의 흥분을 억제하여 혈관의 수축을 방지하므로 혈관을 확장하여 혈액의 순환을 돕습니다. 그렇기 때문에 EPA 함유가 풍부한 등 푸른 바다 생선을 많이 먹는 에스키모인들에게 심근경색은 거의 없다고 합니다.",http://www.acdm.or.kr/bbs/505.php?&fm_id=2&page=10,한국만성질환관리협회
고혈압,"고혈압의 정도, 즉 중증도는 어떻게 압니까?","고혈압은 임상적으로나자 각 증세만으로는 병의 경증을 판단할 수가 없지만, 비교적 간단히 시행할 수 있는 몇 가지 소견을 종합하면 환자의 현재 상태를 파악할 수 있으므로 고혈압이 발견되면 누구나 필요한 검진을 받아야만 합니다. 따라서, 고혈압의 중증도(重症度)는 혈압치 외에도 여러 가지 기준을 종합 평가하는 것이 중요합니다. 첫째, 최근에는 미국 합동전문위원회(J.N.C)에서 결정한 기준에 따라 혈압을 분류하는 방법을 많이 사용하고 있는데, 이에 따르 면 확장기 혈압이 90~104㎜ Hg는 경증 고혈압, 105~114㎜ Hg는 중등도 고혈압, 115㎜ Hg 이상은 중증 고혈압으로 분류되어 진단 및 치료의 기준이 되고 있습니다. 또한 확장기 혈압은 90㎜ Hg 이하의 정상이나, 수축기고혈압이 140~150㎜ Hg일 때는 경계역 수축기 고혈압, 160㎜ Hg 이상일 때는 수축기고혈압이라고 합니다. 둘째, 눈 속의 안저혈관 상태를 관찰해 제1도에서 제4도까지 분류하는데, 이것은 오래전부터 고혈압의 중증도를 비교적 쉽게 가려낼 수 있는 방법으로 고혈압의 중증도를 비교적 쉽게 가려낼 수 있는 방법으로 고혈압 환자라면 반드시 알아보는 검사 가운데 하나입니다. 셋째, 흉부X-선이나 심전도, 소변검사로 심장 기능과 신장 기능을 알아본 다음이들을 종합해서 고혈압의 중증도를 판단하는 것입니다. 또한 이 결과로 합병증의 발생 여부와 예후에 대해서도 어느 정도 짐작이 가능합니다.",http://www.acdm.or.kr/bbs/505.php?&fm_id=2&page=11,한국만성질환관리협회
고혈압,혈압은 얼마나 자주 측정해야 합니까?,"지금이라도 자신의 혈압이 얼마인지 모르는 사람은 곧 혈압을 측정해 보고 정상 혈압, 즉 수축기 140, 확장기 90 이하 인 사람은 1년에 1회씩만 계속 재어보면 됩니다. 자신의 혈압이 고혈압인 경우, 즉 수축기혈압 160 이상, 확장기 혈압 95㎜ Hg 이상인 사람은 약물치료를 시작하기 전에 일반적인 주의사항 특히 식이요법, 체중조절 및 정신적 안정을 취하면서 1주일 간격으로 혈압을 계속 측정해본 후에.약물치료를 하는 것이 원칙입니다. 혈압이 조절되어 정상 이 될 때까지는 1주일마다 혈압을 재고 약을 증감하는 것이 좋고, 정상 혈압이 된 후에는 1개월마다 혈압을 측정하고 의사와 상의해도 무방합니다. 따라서 고혈압 환자가 있는 가정은 혈압기를 비치하고 정기적으로 혈압을 측정하여 기록하는 습관을 가지는 것이 환자의 치료 경과를 관찰하는 데 매우 편리합니다. 실제로 이와 같은 목적으로 혈압기가 일반 가정에 많이 보급되고 있으며, 혈압측정이 기술상으로 쉽기 때문에 누구나 가능한 일입니다. 더구나 최근에는 자동혈압측 정기가 개발되었으므로 더욱 문제가 없습니다. 따라서, 누구든지 자신의 현재 혈압이 얼마인지는 최소한 알고 있는 것이 매우 중요한 일이라는 것을 다시 한 번 더 강조합니다. 중간형 협심증의 범위에 드는 협심증은 심근경색으로 이행할 가능성이 있으므로 주의해야 할 것입니다. 따라서 이중간 형이라는 이름은 심근경색과 협심증 사이에 위치하는 병이라는 의미로 붙여진 것입니다.",http://www.acdm.or.kr/bbs/505.php?&fm_id=2&page=12,한국만성질환관리협회
고혈압,고혈압 치료에서 꼭 명심할 것은 무엇입니까?,"고혈압을 치료하는 목적은 한마디로 사망률을 떨어뜨리는 데 있습니다. 혈압이 지속적으로 높으면 동맥혈관에 경화를 일으키고 이로 인해서 뇌졸중·협심증 및 심근경색증·심부전 그리고 신부전 등을 일으킵니다. 그러나, 고혈압을 철저히 치료해서 혈압을 정상으로 유지하면 이러한 합병증으로 인한 사망률이 55%에서 18%로 감소한다고 합니다. 또한, 아무리 심하고 오래된 말기의 고혈압 환자라도 적극적인 치료를 하게 되면 상당히 좋은 효과를 얻을 수 있습니다. 고혈압 치료를 시작하기 전에 꼭 필요한 것은 환자와 가족들에게 고혈압에 대한 것과 치료를 적절히 받으면 치명적인 합병증을 사전에 예방할 수 있다는 점과 중요한 것은 일생 동안 치료해야 된다는 사실입니다. 고혈압 환자는 대개 자신이 고혈압이라는 사실을 처음 알았을 때는 얼마 동안 모든 환자들이 치료를 계속하지만, 곧 의식적으로 또 무의식적으로 포기하는 예가 많습니다. 미국의 통계에 의하면 전체 고혈압 환자 중 치료해서 정상 혈압을 유지하고 있는 환자가 38%, 치료 하고 있지만 아직 혈압이 높은 환자가 16%, 고혈압인 줄 알면서도 치료하지 않고 있는 환자가 21%, 자신이 고혈압인 줄도 모르는 사람이 25%라고 합니다. 우리나라에서는 이보다 훨씬 뒤지고 있으므로 말할 것도 없습니다. 따라서, 고혈압은 조기 발견해서 일생 동안 꾸준히 치료해 정상 혈압을 유지하는 것이 매우 중요한 일입니다.",http://www.acdm.or.kr/bbs/505.php?&fm_id=2&page=13,한국만성질환관리협회
당뇨병,췌장의 무게는 얼마나 됩니까?,350~450g 정도입니다.,http://www.acdm.or.kr/bbs/505.php?fm_id=5,한국만성질환관리협회
당뇨병,췌장의 길이는 얼마나 됩니까?,12~18㎝ 정도입니다.,http://www.acdm.or.kr/bbs/505.php?fm_id=5,한국만성질환관리협회
