keyword,question,answer,url,source
당뇨병,당뇨병이란 어떤 병입니까?,"음식물을 섭취하여 위장관에서 흡수된 영양분은 일단 혈액 내에 모였다가 다시 여러 조직의 세포 속으로 이동하여 들어가 대사 작용의 원료로서 이용되게 되어 있습니다. 혈액 내에 모인 포도당은 반디스 인슐린이라는 호르몬의 도움을 받아야 세포 내로 이동되어 갈 수 있게 되는데 만약 인슐린이 없거나, 인슐린이 있어도 인슐린의 작용이 순조롭게 되지 않으면 결국 혈액 속의 포도당은 세포 속으로 들어가지 못하고 이용되지도 못하며, 혈액 속에 축적되므로 정상인의 기준치보다 높은 고 혈당 상태가 초래됩니다. 이러한 고혈당 상태가 지속됨으로써 나타나는 여러 가지 증상 및 합병증을 당뇨병이라고 합니다.",http://www.acdm.or.kr/bbs/505.php?fm_id=6,한국만성질환관리협회
당뇨병,여기서 '당'이란 무엇입니까?,"포도당을 말하는데 우리가 주식으로 하는 쌀이나 보리의 기본 구성 성분이 되는 탄수화물이고, 이런 음식물을 먹었을 때 포도당으로 분해되어 우리 몸 속으로 흡수되어 들어가서 혈액 속에 돌아다니다가 소변으로 나오는 것입니다.",http://www.acdm.or.kr/bbs/505.php?fm_id=7,한국만성질환관리협회
당뇨병,혈당의 정상 수치는 얼마입니까?,보통 70~120㎎/㎗정도로 우리 체내의 중요한 에너지원입니다.,http://www.acdm.or.kr/bbs/505.php?fm_id=8,한국만성질환관리협회
당뇨병,당뇨병의 진단은 어떻게 합니까?,"혈액 속에 들어있는 포도당의 농도를 측정하여 기준치보다 높을 때 진단이 됩니다.즉, 공복 상태에서 채혈하여 혈청 내의 포도당 농도가 140㎎/㎗ 이상이거나, 공복시 농도에 관계없이 식후 2시간 치 또는 포도당 80그람을 먹고 2시간 후에 혈청 내의 포도당 농도가 200㎎/㎗ 이상이면 당뇨병으로 진단하게 됩니다.",http://www.acdm.or.kr/bbs/505.php?fm_id=9,한국만성질환관리협회
당뇨병,소변에서 당이 검출되면 당뇨병으로 진단해도 무방합니까?,"그렇지 않습니다. 일반적으로 혈당이 높아지면 소변에 당이 나오게 되지만, 혈당은 정상 수준인데도 요당이 검출될 수가 있습니다. 반면에 요당은 검출되지 않아도 당뇨병인 경우가 있습니다. 소변에 당이 검출되려면 혈당은 적어도 180㎎/㎗ 이상이어야 합니다. 그러나 공복혈당이 140㎎/㎗만 넘으면 당뇨병으로 진단하게 되므로, 조기 당뇨병 상태에서는 소변당이 검출되지 않을 수가 있습니다. 따라서 요당이 검출되면 당뇨병을 의심하고, 혈당 검사를 하여 기분치 보다 높은 고혈당을 확인하여야 진단이 됩니다. 그리고 소변은 생성된 소변이 방광 내에 수시간 동안 모였다가 나오는 것이므로 검사 당시의 혈당을 바로 나타내 주지 못합니다. 따라서 요당 검사는 당뇨병 진단 및 경과 판정에 제한된 부분적 의미를 가질 뿐이며, 언제나 혈당을 기준으로 진단하고 판정하여야 합니다.",http://www.acdm.or.kr/bbs/505.php?fm_id=10,한국만성질환관리협회
당뇨병,소변에서는 당이 나오지 않아도 혈액에서 나오는 경우가 있습니까?,"이것은 매우 구체적인 질문이 아닌가 싶군요. 일반적으로 소변에서 당이 나오게 되면 당뇨병이 아닌가 하는 의심을 갖고 혈액검사를 하게 됩니다. 혈액검사란 혈액 속에 있는 포도당의 양을 측정하는 일이지요. 그리고 혈액 속에 있는 포도당의 양이 정상인보다 훨씬 높은 결과가 나오면 당뇨병이란 의심이 매우 짙어집니다. 소변에서 당이 나올 정도로 혈당이 높아져 있고, 그 혈당은 정상인의 혈당보다 훨씬 높다는 점 등을 가지고 당뇨병이란 진단을 내리게 되는데, 반대로 혈당이 높기만 하면 소변에서 당이 나오지 않더라도 당뇨병이라 단정해도 좋은 가라는 질문이 나올 수 있다고 생각됩니다. 여기에서 소변에 당이 나오지 않더라도 당뇨병이란 진단을 내릴 수 있느냐의 여부는 매우 어려운 문제입니다. 당뇨병을 발견하는 실마리는 소변을 검사하여 당이 나왔을 경우 당뇨병이 아닐까 하고 의심을 갖기 때문에 이러한 의심의 요인도 없이 대뜸 혈당을 조사한다는 것은 매우 드문 예라 할 수 있습니다. 그러나 최근에는 종합진찰제도가 상당히 보급되었기 때문에 혈당 검사, 특히 포도당부하 시험이라는 것은 일반적인 방법이 되었고, 소변에서 당이 나오지 않아 도 시행하는 빈도가 점차 늘고 있습니다. 현재 소변에서 당이 나오지 않지만, 혈당이 당뇨병을 의심할리만큼 현저하게 높다면 즉, 당뇨병형(糖尿病型)인 혈당을 나타냈을 경우에는 [우선 당뇨야 어떻든 간에] 당뇨병에 대한 의심을 가져야 한다는 것이 상식으로 되어 있습니다. 일반적으로 혈당이 1백80㎎/㎗ 이상되면 소변에서 당이 나오기 마련입니다. 이것은 노령 자인 경우가 많은데, 혈당이 250 이상이라야 소변에 당이 나오는 수도 있습니다. 혈당이식 후 또는 포도당부하 시험 후에 250이상의 수치를 몇 시간 동안 유지하고 있다는 겄은 당뇨병이 아니고서는 매우 희귀한 일입니다. 그런 상태라면 먼저 당뇨병 상태를 의심합니다. 따라서 혈당이 포도당부하 시험 후 또는 식후에 몹시 높은 수치를 유지하고 있으면서 소변에 당이 나오지 않을 경우, 이것도 우선 당뇨병이라 단정해도 무방하리라 봅니다. 극단적인 경우, 인공신장(人 工腎臟) 등에서 소변이 전혀 나오지 않을 때도 당뇨병은 일어납니다. 그런 경우도 역시 갈증이 생기는 증세는 강하게 나타납니다. 혈당을 측정해보면 분명히 당뇨병이라 단정할 정도로 높아져 있는 경우도 있습니다.",http://www.acdm.or.kr/bbs/505.php?fm_id=11,한국만성질환관리협회
당뇨병,인슐린'이란 무엇입니까?,"인슐린이란 췌장의 베타세포에서 생성되어 분비되는 호르몬입니다. 정상인에서는 혈당이 상승되면 즉각적으로 인슐린이 분비되어 혈액 속의 포도당을 세포 내로 이동시켜 산화작용 등 세포 내 대사 작용을 촉진시키며 특히 섭취된 영양분을 간세포로 이동시켜서 당원 질의 형태로 저장하게 되며, 지방질의 분해를 억제하는 일을 하게 됩니다. 만약 인슐린이 없거나 작용이 제대로 되지 않으면 이러한 세포 내 영양분의 이동이나 저축이 되지 않으므로 서 혈당이 상승되어 당뇨병이 되 는 것입니다.",http://www.acdm.or.kr/bbs/505.php?fm_id=12,한국만성질환관리협회
당뇨병,"약년형 (제1형, 인슐린 의존형) 당뇨병의 원인은 무엇입니까?","인슐린을 생성하고 분비하는 췌장의 베타세포가 파괴되어 인슐린을 분비할 수 없는 상태를 소아형 당뇨병이라고 합니다. 베타세포가 파괴되는 원인은 아직 확실히 밝혀져 있지 않으나, 어떤 원인으로 베타세포를 공격하여 파괴시키는 자가항체가 몸 안에 생겨나므로 그 항체가 베타세포를 공격하는 것으로 되어 있습니다. 일부에서는 바이러스균이자가 항체 생성의 원인으로 증명되어 있습니다.",http://www.acdm.or.kr/bbs/505.php?fm_id=13,한국만성질환관리협회
당뇨병,"성인형(제2형, 인슐린비의존형) 당뇨병의 원인은 무엇입니까?","성인형 당뇨병의 원인은 한마디로 말하기 어렵습니다.성인형 당뇨병에서도 베타세포로부터의 인슐린 분비가 저하되어 있기도 하지만 분비보다는 작용이 잘 되지 않는 것이 더 중요한 원인이 됩니다. 인 슐린이 있어도 작용이 제대로 되지 않는 상태를 인슐린 저항성이라고 말합니다.인슐린저항성이 강하면 강할수록 혈당은 상승되고, 당뇨병이 더 심하게 나타나게 됩니다.",http://www.acdm.or.kr/bbs/505.php?fm_id=14,한국만성질환관리협회
당뇨병,인슐린 저항성 의 원인은 무엇입니까?,"비만·스트레스·약물 등 ‥‥, 아직 명확히 다 밝혀지지 않은 상태지만, 지금껏 밝혀진 것 중에서 제일 중요한 원인은 비만 증입니다.췌장에서 분비된 인슐린이 세포 내로 들어가 작용을 하려면 우선 세포 표면에 존재하는 수용체와 결합해야 하는데, 비만한 사람은 이 수용 체 숫자가 감소되어 있어서, 인슐린이 많이 있어도 인슐린의 효과가 감소됨으로써 저항성으로 나타나게 됩니다. 다음으로 여러 가지 형태의 스트레스가 저항성을 유발시키게 됩니다.스트레스를 받으면 여러 가지 스트레스 호르몬이 필요 이상으로 분비됨으로써, 인슐린의 분비가 제대로 되지 않도록 방해할 뿐만 아니라 인슐린 작용도 방해함으로써 인슐린 저항성을 유발하게 됩니다. 그 밖에 어떤 약물들은 혈당을 높히거나 인슐린의 작용을 방해함으로써 인슐린 저항성을 일으키게 됩니다. 따라서 비만증을 피하고 약물 복용에서 신중을 기하며, 스트레스를 피하거나 잘 해소하는 것은 당뇨병을 예방하거나 치료하는 데 매우 중요한 기본 요건이 되겠습니다.",http://www.acdm.or.kr/bbs/505.php?fm_id=15,한국만성질환관리협회
당뇨병,당뇨병의 초기에는 자각증상이 없다고 하는데 증세는 어떻게 진행하는 것일까요?,"당뇨병에는 두 가지가 있습니다. 첫째는 약년형 당뇨병이라고 하는 것이 있는데, 이 경우는 발병했을 때부터 두렷한 자각증상이 일어납니다. 돌연히 어느 날 갈증이 생기든가, 소변이 많아진다든가 살이 빠진다든가 합니다. 그러나 성인형 당뇨병일 경우, 발병 초기에 자각증상이 거의 없는 것이 통례입니다. 그리고 질환이 무거워짐에 따라 점차 증세가 나타납니다. 그러므로 아직 자각증상이 없을 때 당뇨병을 발견, 이에 알맞는 치료를 시작하면서 의사의 지시를 어김없이 지킨다면 자각증상이 없는 사태로 써 몇 해를 보낼 수 있습니다. 초기엔 자각증상이 없더라도 점차 자각증상이 나타나게 된다는 것은 조기 발견이 늦어져 치료를 하지 않고 있는 동안에 당뇨병의 정도가 심해졌다는 것을 뜻하는 것입니다. 당뇨병 환자가 적당하지 않은 생활태도를 취하고 있기 때문에 증세가 진행되는 것이라 할 수 있습니다.",http://www.acdm.or.kr/bbs/505.php?fm_id=16,한국만성질환관리협회
당뇨병,당뇨병의 증상으로는 어떤 것이 있습니까?,"가장 흔한 증상은 소변을 자주 많이 보게 되고 물을 많이 마시며, 음식을 많이 먹게 되는 것입니다. 혈당이 180㎎/㎗ 이상되면, 혈중의 포도당은 소변으로 빠져나오게 되는데 이때 많은 양의 물이 함께 빠져나오기 때문에 체내에는 물이 부족한 상태가 됩니다. 물을 많이 마시게 되는 것은 소변으로 포도당과 함께 소실된 물을 보충하려는 일종의 보상작용인 것입니다. 따라서 당뇨병 환자가 갈증을 느낀다는 것은 혈당이 높아 물이 소변으로 빠져나가고 있다는 증거이며, 갈증이 있을 때에는 물을 섭취하여, 탈수현상에 들어가지 않도록 하여야 합니다. 음식을 많이 먹는 것은 섭취한 영양소가 세포 내에서 잘 이용되지 못함으로써 세포 내에서 잘 이용되지 못함으로써 세포 내에는 영양결핍 상태가 되어, 대뇌의 만복감을 감지하고 조절하는 중추에서는 공복감을 느끼게 됨으로 계속 음식을 먹고 싶어지게 됩니다. 그 밖에도 피로감, 감염증, 가려움, 신경통, 시력장애 등이 있으며 때로는 자각증상이 거의 없는 사람도 있습니다.",http://www.acdm.or.kr/bbs/505.php?fm_id=17,한국만성질환관리협회
당뇨병,소아의 당뇨병과 성인의 당뇨병은 다른 점이 있습니까?,"일반적으로 15세 안에 일어나는 당뇨병인 경우에는 약년형 당뇨병이 많고, 40세 이후 일어나는 당뇨병에는 성인형 당뇨병이 많다고 할 수 있습니다. 따라서 소아의 당뇨병인 경우에는 우선 약년형이라 생각하고 인슐린 주사를 중심으로 하는 치료에 의해, 그리고 특히 비만 형성인에게 일어나는 당뇨병인 경우에는 성인형 당뇨병이라 간주, 식사요법을 중심으로 한 치료에 의해 대처하는 것이 필요합니다. 본질적으론 소아의 당뇨병이나 성인의 당뇨병이 다를 바 없기 때문에 인슐린 부족에 적응한 치료법을 원칙으로 합니다.과식 때문에 뚱보가 되고, 당뇨병 상태가 악화된 것이라면 먼저 비만증부터 없애도록 식사를 충분히 제한함으로써 인슐린 부족을 보충하고, 약년형 당뇨병과 같이 식사요법으론 인슐린 부족을 보충할 수가 없는 당뇨병일 경우에는 그 부족된 인슐린을 밖에서 주사로 투여하는 치료법을 시행하는 것입니다. 약년형 당뇨병이든, 성인병 당뇨병이든 치료하는 방법 그 자체는 다를 바 없습니다만 치료하는 수단에 차이가 있게 됩니다 .그런 점에서 소아의 당뇨병과 성인의 당뇨병은 다른 점이 있다고나 할까요. 또한 넓은 뜻에서 치료법의 차이를 말한다면 성인의 경우와 소아의 경우에서는 환자의 연령과의식 등에 많은 차가 있다는 것을 고려할 필요가 있습니다.즉, 소아인 경우, 이제부터 당뇨병을 지닌 인생이라는 테두리 안에서 취학·취직·결혼·육아 등 여러 문제와 맞서지 않으면 안 됩니다.이 미 취직을 하고 있고 아이도 갖고 있는 어른과는 이런 면에선 전혀 다르다고 할 수 있지요. 그리고 또 유아일경 우에는 자신이 질병에 걸려 있다는 인식조차 갖고 있지 않습니다. 소아 당뇨병인 경우, 이제부터 가장 민감하게 되기 쉬운 사춘기를 겪지 않으면 안 되는 것입니다.이미 자기 혼자만으론 도저히 감당할 수 없는 문제가 소아당뇨병의 경우 연달아 일어날 것이라고 각오하지 않으면 안 됩니다. 그들에 대한 사회 전체의 따뜻한 이해라든가 힘을 복돋아주는 일이 꼭 필요하다고 할 수 있습니다.",http://www.acdm.or.kr/bbs/505.php?fm_id=18,한국만성질환관리협회
당뇨병,인슐린 주사를 맞기 시작하면 평생 동안 맞아야 합니까?,"반드시 그렇지는 않으며 환자의 조건에 따라서 다릅니다.성인형 당뇨병 환자가 인슐린 처방을 받는 경우는 크게 두 가지 경우가 있습니다. 첫째는 경구혈당강하제로 혈당 조절에 실패한 경우인데, 이 경우는 더 이상 환자 자신으로부터의 인슐린 분비가 충분하지 못한 상태로서 평생 동안 인슐린 주사를 맞아야 합니다.대개 당뇨병이 발생된 지 오래된 환자들이 이에 해당됩니다.다음은 자체의 인슐린 분비는 아직 충분하지만 인슐린 저항성이 강하여 자체의 인슐린 분비만으로는 충분 하지 못해 일시적인 지원 형태를 인슐린이 요구되는 경우로서, 이런 경우에는 인슐린 저항성이 완화되거나 해소되면 더 이상 인슐린 주사가 필요 없고 경구혈당강하제나 식사요법만으로 혈당조절이 가능하게 됩니다. 감염이 되었거나 큰 상처를 입은 경우와 수술을 받게 될 때에는 일시적으로 인슐린을 주사해야 하며, 어떠한 경우라도 혈당을 신속히 저하시켜야 할 필요성이 있으면 인슐린을 사용하는 것이 효과적입니다.",http://www.acdm.or.kr/bbs/505.php?&fm_id=5&page=2,한국만성질환관리협회
당뇨병,인슐린요법은 자택에서도 할 수 있는지요?,"물론 인슐린요법은 자택에서 할 수 있습니다. 할 수 있다기보다 반드시 자택에서 답) 물론 인슐린요법은 자택에서 할 수 있습니다. 할 수 있다기보다 반드시 자택에서 쉬어서는 안 될, 때로는 하루에도 아침과 낮, 저녁, 세 번 주사를 맞지 않으면 알될 경우가 있기 때문입니다.만일 인슐린요법을 하루라도 쉰다면, 그대로 당뇨병성 혼수에 빠지고 마는 것이 바로 약년형 당뇨병입니다. 모든 의료행위를 의사만이 할 수 있도록 법에서 규정한 것도 타당한 것이긴 하나, 인슐린요법 은환자 자신이 할 수 있도록 길을 터주는 것도 필요하지 않을까 생각됩니다. 아무런 지식도 없으면서 인슐린 주사를 환자 자신이 놓는다는 것은 적지 않은 위험이 따르기 때문에 물론 의사가 허가할까닭이 없습니다. 그리고 또 아무런 사전 지식 없이 인슐린요법을 환자가 제멋대로 한다면 법으로 문책을 당해도 어쩔 수 없는 것이겠지요. 그러기 때문에 충분한 지식을 갖고 의사와 간호사로부터 상세한 방법을 익힌 다음, 비로소 인슐린요법은 자택에서도 가능하게 되는 것입니다. 하 지만 이에는 많은 어려운 문제가 따르리라 생각됩니다.",http://www.acdm.or.kr/bbs/505.php?&fm_id=5&page=3,한국만성질환관리협회
당뇨병,몸이 아파서 식사를 제대로 할 수 없을 때는 인슐린이나 경구혈당강하제 투여를 하지 않아도 됩니까?,"절대로 투약을 중단하면 안 됩니다. 몸이 아프면 스트레스 호르몬의 작용으로 인슐린의 효과가 저하되며, 간에서 포도당을 더 많이 만들어냄으로 혈당이 급격히 상승됩니다. 따라서 평소 사용하던 약제를 계속해야 하며, 정상적인 식사가 되지 않으면 당분이 포함된 음료수나 수분 섭취를 충분히 해야 하며, 미음이나 죽으로 소량씩 자주 섭취해 보고, 계속 회복되지 않으면 의사와 상의하여 포도당 주사를 맞아야 합니다.",http://www.acdm.or.kr/bbs/505.php?&fm_id=5&page=4,한국만성질환관리협회
당뇨병,저혈당증이란 무엇이며 왜 나타나게 됩니까?,"혈당이 50㎎/㎗이 하로저하되었을 때 나타나는 증상을 말합니다.식은땀이 나고 손발이 떨리고 현기증이나 흥분, 불안감이 오며, 가슴이 빨리 뛰고, 공복감이나 두통, 전신무력 상태가 오며, 심하면 경련을 하거나 혼수상태에 들어가게 됩니다. 원인은 인슐린이나 경구혈당강하제의 용량이 많은 경우, 약용량은 적당해도 식사량이 적거나 식사시간이 지체될 경우가 제일 많으며, 식사나 투약이 모두 적당해도 평소보다 운동량이 많으면 볼 수 있습니다. 공복시의 과다한 음주도 저혈당을 초래합니다. 저혈당증이 발생되면 신속히 당분이 함유된 음료수나 사탕을 먹어야 하며, 의식이 없는 경우에는 절대로 입으로 먹이지 말고 포도당 주사를 주입해야 합니다. 약물치료 중인 당뇨병 환자는 만약의 사태에 대비하여 늘 사탕을 소지하고 다녀야 하며, 혼수상태에서 주변의 도움을 받을 수 있도록 당뇨병 환자임을 표시하는 증표를 소지하는 것이 필요합니다.",http://www.acdm.or.kr/bbs/505.php?&fm_id=5&page=5,한국만성질환관리협회
당뇨병,젊고 몸이 말랐더라도 당뇨병에 걸리는 수가 있는지요?,"약년형 당뇨병이란 것은 성인형 당뇨병과 달라별 안 간에 나타나는 당뇨병입니다만, 이 약년형 당뇨병은 도리어 젊고 깡마른 사람에게서 일어납니다. 우리나라 당뇨병의 약 5% 정도는 이 약년형 당뇨병이 아닌가 추측되고 있습니다. 성 인형 당뇨병이란 것은 원래 40세 이상 인 사람, 특히 비만인 사람에게 일어나는 경우가 많습니다만 젊은 사람, 가령 어린 아이에게 이성 인형 당뇨병이 일어나는 케이스도 결코 드물지 않습니다. 그리고 또 때로는 젊은 사람이거나 깡말랐 더라도 성인형 당뇨병이 일어납니다. 특히, 유전적인 경향이 강한 사람, 양친 혹은 한쪽 어버이에게 당뇨병이 있는 젊은 사람은 젊었을 때부터, 또한 그다지 뚱보가 아니더라도 성인형 당뇨병이 모르는 사이에 일어나는 경우가 적지 않습니다. 그렇기 때문에 젊고 깡말랐다고 해서 당뇨병이 일어나지 않을 거라곤 말할 수 없습니다.",http://www.acdm.or.kr/bbs/505.php?&fm_id=5&page=6,한국만성질환관리협회
당뇨병,요사히 젊은 사람에게 당뇨병이 늘어나고 있다는데 사실입니까?,"원인은 아마 식생활의 서구 화일 것입니다.뚱뚱한 고교생 중에서 공복시의 혈당치가 300㎎/㎗이나 되는 사람이 있습니다. 그런데, 이런 경우는 식사요법이 썩 잘 맞으면 1~2주일에 정상치로 돌아갑니다. 비만인의 고혈당은 조금도 두려워할 것이 없습니다. 저희는 이런 젊은이들에게 '식사요법을 지키면 반드시 나으니까 노력하라'고 말하고 있습니다.",http://www.acdm.or.kr/bbs/505.php?&fm_id=5&page=7,한국만성질환관리협회
당뇨병,당뇨병 환자에게 반드시 식사요법이 필요한 이유는 무엇입니까?,"당뇨병 환자는 식사 후에도 반드시 혈당이 상승되는데, 식사의 양과 종류를 조절하식 후 혈당 상승의 폭을 낮출 수 있습니다. 또한 저혈당을 방지하며, 섭취 열량의 조절로 표준 체중을 유지할 수 있고 지질대사를 정상화시켜 동맥경화증을 예방하기 위하여 반드시 식사요법을 지켜야 합니다.",http://www.acdm.or.kr/bbs/505.php?&fm_id=5&page=8,한국만성질환관리협회
당뇨병,"이상 체중, 또는 표준 체중이란 무엇입니까?","당뇨병 치료를 해 나갈 때, 환자는 현재 체중이 얼마 또 이상 체중이 얼마라는 것을 알아둘 필요가 있습니다. 식사요법에 따라 치료할 때 체중이 목표 체중, 즉 이상 체중에 접근해 가고 있는 가의 여부는 극히 중요한 문제이기 때문입니다. 특히 뚱보일 경우, 이상 체중을 과녁 삼아 식사요법을 지속해야 한다는 것은 당뇨병 치료의 근본이라 할 만큼 중요한 것입니다. 당뇨병은 인슐린 작용의 부족에 의해 일으키는 질병이지만, 이 인슐린은 음식의 섭취량과 체중에 따라 좌우되기 마련 입니다.뚱보라면 뚱보가 되어 있는 만큼 인슐린을 필요로 한다는 것은 자명한 일입니다. 체중을 감소시켜 꼭 알맞은 체중으로만듦으로써 필요한 인슐린 양을 감소시켜 나간다는 것은 치료의 목적에 부합되는 매우 중요한 일입니다. 표준체중이란 성별, 신장별 평균 체중을 말합니다. 이것은 바야흐로 성장이 멎고, 아직 뚱보가 되기 전의 체중인 것입니다.이 정상인의 표준 체중을 가지고 이상 체중을 생각한다는 것은, 설정하기 쉬운 하나의 목표라 할 수 있습니다. 아무리 표 중체중이라 할지라도 각 사람의 골격과 근육의 발달상태에 따라 체중은 크게 달라지기 때문에, 신장이 같다고 해서 이 표준체중을 일률적으로만인의 이상 체중이라고 할 수는 없습니다.",http://www.acdm.or.kr/bbs/505.php?&fm_id=5&page=9,한국만성질환관리협회
당뇨병,표준 체중의 계산은 어떻게 합니까?,표준 체중(㎏)=[키(㎝)-100]X0.9입니다.,http://www.acdm.or.kr/bbs/505.php?&fm_id=5&page=10,한국만성질환관리협회
당뇨병,섬유소가 많이 함유된 음식물이 당뇨병 조절에 유익한 이유는 무엇입니까?,"고섬유 소식품은 위장에서 소화되어 소장으로 내려가는 데 시간이 오래 걸리므로 포만감을 주게 되며, 장으로부터의 흡수시간이 지연됨으로써 혈당이 서서히 완만하게 상승되기 때문에 유익합니다.",http://www.acdm.or.kr/bbs/505.php?&fm_id=5&page=11,한국만성질환관리협회
당뇨병,식품교환표란 무엇입니까?,"식품들을 서로 비슷한 영양가를 함유한 식품끼리 구분하여 같은 식품 안에서는 서로 다른 식품끼리 바꾸어 섭취할 수 있도록 구분하여 놓은 표입니다. 예를 들면, 쌀밥 1/3 공기와 보리밥 1/3 공기, 삶은 국수 1/2공기는 종류는 달라도 모두 100칼로리의 열량을 내는 1단위 식품으로 개인의 기호에 따라서 바꾸어 먹을 수 있는 것입니다.",http://www.acdm.or.kr/bbs/505.php?&fm_id=5&page=12,한국만성질환관리협회
